page_id,title,triple_count,entity_count,coherence_score,routing,matched_categories
page_0489,Patient-led assessments of the care environment dementia-friendly environments: guidance for assessors - NHS England Digital,3,7,0.914,COHERENT,Clinical discipline; Topic; Publication type; Tags; National priorities
page_0490,Guidance and information for patient assessors - NHS England Digital,2,3,0.8,COHERENT,Publication type; Tags; National priorities
page_0492,Quality Accounts - NHS Digital,3,6,1.0,COHERENT,Region; Publication type; Profession; Tags; Recruitment format; National priorities
page_0493,Domain 1 - Preventing people from dying prematurely - NHS Digital,3,6,0.6,AMBIGUOUS,Region; Tags; Clinical discipline; Training type
page_0495,Domain 4 - Ensuring people have a positive experience of care - NHS Digital,2,4,0.957,COHERENT,Region; Tags; Recruitment format; National priorities
page_0496,Domain 5 - Treating and caring for people in a safe environment and protecting them from avoidable harm - NHS Digital,3,6,0.9,COHERENT,Publication type; Tags; Topic
page_0497,Maternity and Neonatal Data Hub - NHS Digital,3,6,1.0,COHERENT,Region; Topic; Publication type; Tags; Recruitment format; National priorities
page_0498,Prescribing - NHS Digital,3,6,0.9,COHERENT,Region; National priorities; Publication type; Tags; Profession; Recruitment format
page_0499,Practice Level Prescribing in England: a summary - NHS Digital,3,6,0.8,COHERENT,Publication type; Tags; National priorities
page_0502,Primary care - NHS Digital,3,9,0.933,COHERENT,Tags; Clinical discipline; National priorities
